{
  "schema_version": 4,
  "epic_id": "approved-spec-binding-contract",
  "revision": 1,
  "approved_spec_binding": {
    "path": "knowledge/wiki/syntheses/loop-skill-approved-spec-binding-contract-input-packet.json",
    "sha256": "3779e815b4be7438b36e9fb53073fa1d3ab20f07cd5ad1c531fa075c11b457e7",
    "gate_commit": "ad9adeab69bcafd761d8457e9c33d1b4c26096d5"
  },
  "epic_base": {
    "ref": "codex/approved-spec-binding-contract",
    "sha": "ad9adeab69bcafd761d8457e9c33d1b4c26096d5",
    "branch_state": "active",
    "worktree_path": "/Users/omitsuhashi/.codex/worktrees/09cc/skills"
  },
  "execution_policy": {
    "parallel_preferred": false,
    "serial_fallback_preapproved": true,
    "worker_context_required": true,
    "coordinator_may_implement": false,
    "serial_fallback_mode": "worker_context_only",
    "implementation_slots": 1,
    "review_slots": 1,
    "wave_is_barrier": false
  },
  "review_policy": {
    "primary": "requesting-code-review",
    "fallbacks": [
      "equivalent-independent-reviewer"
    ],
    "manual_fallback_preapproved": false,
    "max_review_cycles": 2,
    "max_fix_cycles": 2,
    "same_finding_limit": 2,
    "hardening_candidates": {
      "candidate_registry_path": "decisions/hardening-candidates.json",
      "max_candidates_per_issue": 5,
      "max_summary_words": 80,
      "issue_completion_blocking": false,
      "ready_or_merge_requires_decisions": true,
      "worker_packet_decision_state": "forbidden"
    }
  },
  "human_policy": {
    "default_scope": "issue",
    "epic_scope_requires_reason": true
  },
  "context_policy": {
    "paths_first": true,
    "max_worker_packet_words": 450,
    "max_worker_report_words": 350,
    "include_full_spec_text": false,
    "include_full_ledger_text": false,
    "worker_packet_schema": "skills/issue-implementation-loop/assets/schemas/worker-packet.schema.json",
    "worker_packet_template": "skills/issue-implementation-loop/assets/templates/worker-packet.json",
    "worker_packet_validator": "skills/issue-implementation-loop/scripts/validate_worker_packet.py",
    "session_compaction": {
      "soft_trigger_percent": 65,
      "hard_stop_percent": 75,
      "mandatory_handoff_compaction": 1,
      "mandatory_phase_transition_gc": true,
      "carry_forward_capsule_words_default": 400,
      "carry_forward_capsule_words_hard": 600,
      "inline_json_code_diff_lines_hard": 80
    }
  },
  "phase_branch_policy": {
    "planning_artifacts_branch": "current_session_branch",
    "phase_approval_commit_required": true,
    "phase_transition_requires_clean_scope": true,
    "execution_coordinator_context": "fresh_or_compacted",
    "main_planning_session_may_implement": false,
    "worktree_per_issue": true,
    "branch_prefix": "codex",
    "epic_base_ref_pattern": "codex/<epic-id>/epic-base",
    "issue_branch_pattern": "codex/<epic-id>/<local-id>-<slug>",
    "epic_base_owner": "execution_coordinator",
    "issue_branch_owner": "worker",
    "integration_branch_policy": "approved_integration_work_item_only"
  },
  "remote_write_policy": {
    "mode": "local_only",
    "approved_actions": []
  },
  "work_items": {
    "ASBC-002": {
      "branch": "codex/approved-spec-binding-contract/ASBC-002-workers",
      "worktree_path": "/Users/omitsuhashi/.codex/worktrees/09cc/skills",
      "worktree_state": "active",
      "base_policy": {
        "type": "epic_base"
      },
      "write_scope": [
        "path:skills/issue-implementation-loop",
        "path:knowledge/wiki/syntheses/loop-skill-approved-spec-binding-contract-execution-envelope.json"
      ],
      "dependencies": []
    }
  }
}
